Question,Answer,Tags
What were the main characteristics emphasized in the Romantic era compared to the Classical period?,"The Romantic era prioritized emotional expression, individualism, and nationalism over the formal constraints of the Classical period.","RomanticEra, MusicAesthetics"
How did the Romantic period contribute to the expansion of musical language?,"The Romantic period saw a significant expansion of harmonic language, with composers using complex chord progressions and modulations to distant keys. Wagner's ""Tristan und Isolde"" exemplifies this with its ""Tristan chord,"" symbolizing the dissolution of traditional tonality.","RomanticEra, HarmonicLanguage, Wagner"
What changes occurred to the symphony during the Romantic period?,"The symphony underwent radical transformation, exemplified by Beethoven's Ninth Symphony's scale and inclusion of choirs, setting new standards. Composers like Berlioz, Mahler, and Bruckner later created monumental symphonies in length and orchestral forces.","RomanticEra, Symphony, Beethoven"
What role did nationalism play in Romantic music?,"National schools of composition emerged, with composers expressing cultural identity through music. Russian composers like Tchaikovsky and the ""Mighty Five,"" along with others in Bohemia, Norway, and elsewhere, incorporated folk melodies and national themes.","RomanticEra, Nationalism, Composers"
What was Richard Wagner's contribution to opera during the Romantic era?,"Richard Wagner revolutionized opera with his concept of Gesamtkunstwerk (total artwork), which integrated music, drama, poetry, and visual arts, and his use of leitmotifs, influencing both opera and symphonic compositions.","RomanticEra, Wagner, Opera"
